sujet,date,statut
Synthwave et imagerie rétro-futuriste spatiale en décoration,2025-10-12T16:11:57.416634,succès_2025-10-13_09:00
Guardians of the Galaxy : quand les couleurs cosmiques deviennent pop,2025-10-12T16:19:41.226944,échec_publication
Culture rave et nébuleuses fluorescentes dans la déco moderne,2025-10-12T16:23:17.575092,échec_publication
Interstellar et la nouvelle représentation des trous noirs,2025-10-12T16:27:12.139896,succès_2025-10-13_09:00
Science-fiction française et son influence sur l'art spatial européen,2025-10-12T16:32:04.935086,succès_2025-10-13_09:00
Mouvement Outrun : l'obsession pour les horizons cosmiques,2025-10-12T16:41:30.372107,succès_2025-10-13_09:00
Steampunk spatial : l'astronomie rétro réinventée en décoration,2025-10-12T16:48:53.656826,succès_2025-10-13_09:00
Influence de Moebius sur l'esthétique désertique-spatiale,2025-10-12T16:53:15.460124,échec_publication
Cosmic Horror : de Lovecraft aux intérieurs gothiques spatiaux,2025-10-12T16:57:11.553343,échec_publication
Mythologies stellaires africaines dans l'art contemporain,2025-10-12T17:00:29.733276,échec_publication
Science-fiction française et son influence sur l'art spatial européen,2025-10-12T17:38:22.666723,succès
Mouvement Outrun : l'obsession pour les horizons cosmiques,2025-10-13T06:58:49.863457,succès
Steampunk spatial : l'astronomie rétro réinventée en décoration,2025-10-13T07:04:34.644217,succès
Influence de Moebius sur l'esthétique désertique-spatiale,2025-10-13T07:09:10.602359,succès
Comment choisir une palette de couleurs neutres pour un Airbnb ?,2025-10-13T07:48:48.775953,succès
Quelles sont les meilleures idées de décoration minimaliste pour location saisonnière ?,2025-10-13T07:53:18.247636,succès
Comment évaluer si une œuvre supportera années de vapeur et chaleur ?,2025-10-18T14:05:22.234999,succès
Faut-il assortir le tableau au plan de travail ou créer un contraste audacieux ?,2025-10-20T21:02:45.304123,succès
Quelles dimensions pour ne pas gêner l'ouverture des placards hauts ?,2025-10-23T21:02:54.755784,succès
Comment l'éclairage sous-meuble affecte-t-il la perception des couleurs du tableau ?,2025-10-27T21:03:12.768421,succès
Les tableaux avec citations culinaires ajoutent-ils du charme ou sont-ils kitsch ?,2025-10-30T21:02:49.370609,succès
Quel style de tableau pour une cuisine industrielle avec briques apparentes ?,2025-11-03T21:02:58.332184,succès
Comment choisir une œuvre qui plaît à toute la famille réunie pour les repas ?,2025-11-06T21:03:14.002038,succès
Paysages de vignobles ou marchés provençaux : lesquels créent l'ambiance bistrot ?,2025-11-10T21:03:07.602913,succès
Quel budget pour remplacer des murs carrelés nus par de l'art mural ?,2025-11-13T21:03:06.302874,succès
Les tons vifs stimulants ou pastels apaisants : lesquels pour une cuisine conviviale ?,2025-11-17T21:02:49.576099,succès
Quel type de tableau évite d'attirer mouches et insectes vers les représentations alimentaires ?,2025-11-20T21:03:48.235613,succès
Comment un tableau peut-il compenser une cuisine sans fenêtre ?,2025-11-24T21:02:56.881082,succès
Faut-il changer de tableau selon les saisons ou maintenir une base permanente ?,2025-11-27T21:02:47.397871,succès
Comment créer une ambiance café parisien avec les bons choix artistiques ?,2025-12-01T21:03:52.541292,succès
Les œuvres minimalistes fonctionnent-elles dans une cuisine chargée d'ustensiles ?,2025-12-04T21:03:02.821320,succès
Faut-il privilégier un artiste spécialisé dans l'art culinaire ?,2025-12-08T21:02:35.097772,succès
